{
  "abg_event_refs": [
    "runtime-event:2026-07-12T14:28:30.001Z:176:b2fc6ac1-a10c-4a39-a4b1-4256126702f0",
    "runtime-event:2026-07-12T14:28:30.001Z:177:aad5a7e5-3c0d-4eb2-9e26-4e0501c46dc9",
    "runtime-event:2026-07-12T14:28:30.004Z:204:ed70762f-83bc-4ed2-9e06-50a9030c85d0",
    "runtime-event:2026-07-12T14:28:30.017Z:255:8c359b8a-adf8-4e4e-96cd-5eeeda3d7ec2",
    "runtime-event:2026-07-12T14:28:30.025Z:282:908a15cc-92fc-4e61-9d39-091df274295e",
    "runtime-event:2026-07-12T14:28:30.035Z:309:98a2f8ee-d404-4705-a38b-2397904247e0",
    "runtime-event:2026-07-12T14:28:30.002Z:189:07e56cf1-ded3-4388-8d52-9283833017c1",
    "runtime-event:2026-07-12T14:28:30.007Z:220:56a2c9e6-8fc4-4f53-b495-05fd43aaa0bd",
    "runtime-event:2026-07-12T14:28:30.007Z:223:72dfb8aa-9ecf-48c7-8b43-02aa5421ee22",
    "runtime-event:2026-07-12T14:28:30.019Z:267:138c2603-0e50-4062-b518-d4da7a114087",
    "runtime-event:2026-07-12T14:28:30.028Z:294:eaf6a2aa-c1ce-46f0-9b3b-8a8c64be2dcd",
    "runtime-event:2026-07-12T14:28:30.039Z:321:900bc5fa-f4fe-421a-8b8c-ba2bf70809e7",
    "runtime-event:2026-07-12T14:28:30.003Z:201:7d451a6e-f1bb-4f85-ae53-c4f11f9a2783",
    "runtime-event:2026-07-12T14:28:30.015Z:253:c77a7273-c23a-432c-9a81-5424a0e06fb6",
    "runtime-event:2026-07-12T14:28:30.023Z:279:33d16ad1-076b-4787-9eb6-c0da3f6f1575",
    "runtime-event:2026-07-12T14:28:30.033Z:306:35fcfecc-39b4-4baf-bc77-f18a371800d6",
    "runtime-event:2026-07-12T14:28:30.045Z:333:bb958bd4-376e-4ee2-890b-4fb9343f454b",
    "runtime-event:2026-07-12T14:28:30.048Z:335:1fa7837d-ef5b-4e90-8bac-a44a56410ca4"
  ],
  "attestation_digest": "sha256:8a79392a97007a3c25a5ac1a7d850440a1064368076d12a1b65107d5399f9895",
  "attestation_id": "attestation:write://odd_world_model/sandbox/banking_product_model/v1",
  "authority_refs": [
    "authority://odd_world_model/banking-product-example/v1"
  ],
  "created_at": "2026-07-12T14:28:30.403Z",
  "cut_role": "domain_artifact",
  "cut_version": "v1",
  "dependency_identities": [
    "@abiogenesis/typescript-tenant@4.6.0-rc.3#sha256:9cffb372c0dfc00983a5d0e882efbc3d0c3ac937a56f313000f35a4473358113",
    "@odd-glc/route-one-typescript@0.1.0#sha256:7e548f92ecd6b4442f9c9f1feb46dd2edd7e9610a7dae8706482fc65d80fa578",
    "fast-xml-parser@5.10.0#digest-not-published",
    "fast-xml-validator@1.2.0#digest-not-published",
    "json-canonicalize@2.0.0#digest-not-published",
    "odd-world-model-storage@0.1.0#sha256:8a0b494395099062a87094f02beec86f911d95725b9283105fe2729e56a5fa41",
    "duckdb@1.4.5#digest-not-published",
    "pyiceberg@0.11.1#digest-not-published",
    "rfc8785@0.1.4#digest-not-published"
  ],
  "exclusions": [
    "source-evidence://banking_product_model/uninterpreted-html"
  ],
  "fidelity": "lossy_projection",
  "gap_refs": [],
  "governing_refs": [
    "specification/PRODUCT.md",
    "specification/requirements/40-domain-build-verification.md",
    "build_tenants/common/design/adrs/ADR-WM-006-versioned-installed-product-example-sandboxes.md"
  ],
  "graph_invocation_ref": "graph-call:execution_basis:{\"moduleName\":\"gtl://module/odd_world_model/context-memory/v1\",\"startIntent\":{\"scope\":{\"kind\":\"workspace\",\"workspaceRoot\":\"/workspace/odd_world_model/rc3-probe\",\"moduleName\":\"gtl://module/odd_world_model/context-memory/v1\"},\"target\":{\"kind\":\"graph_function\",\"handle\":\"odd_world_model.publish_domain_model\"},\"until\":\"converged\",\"inputBindings\":[{\"assetRef\":\"deterministic-check://odd_world_model/sandbox/banking_product_model/v1\",\"assetType\":\"sandbox_exact_carrier\",\"uri\":\"evidence://odd_world_model/exact/v1?ref=deterministic-check%3A%2F%2Fodd_world_model%2Fsandbox%2Fbanking_product_model%2Fv1&digest=sha256%3Aa16106357ae4543b0209325c6653caea9a61916f6b7cd26c3bbe2b7afa1aaac2\"},{\"assetRef\":\"wm-acceptance://odd_world_model/sandbox/banking_product_model/v1\",\"assetType\":\"sandbox_exact_carrier\",\"uri\":\"evidence://odd_world_model/exact/v1?ref=wm-acceptance%3A%2F%2Fodd_world_model%2Fsandbox%2Fbanking_product_model%2Fv1&digest=sha256%3A87cafcf349aa7b42e2cc5d3c354e93536b586a6034c2dd4d2d846a2c769b1d76\"}]},\"runtimeIdentity\":{\"workerId\":\"worker://odd_world_model/rc3-probe/v1\",\"backendId\":\"backend://abiogenesis/typescript/v4.6.0-rc.3\",\"buildId\":\"build://odd_world_model/typescript/0.1.0-proving.1\",\"resolvedRuntimeRef\":\"runtime://abiogenesis/4.6.0-rc.3\"},\"resolvedPolicy\":{\"resolvedPolicyBundleRef\":\"policy-bundle://odd_world_model/rc3-probe/v1\",\"defaultRegime\":\"F_D\",\"dispatchRef\":\"dispatch://odd_world_model/rc3-probe/v1\",\"approvalSubjectRef\":null},\"runId\":\"run://odd_world_model/odd_world_model.publish_domain_model/rc3-probe/banking_product_model-acceptance-v1\",\"workKey\":\"work://odd_world_model/odd_world_model.publish_domain_model/rc3-probe/banking_product_model-acceptance-v1\",\"frameId\":null,\"frameLineageId\":null}",
  "losses": [
    "retained FIBO HTML pages and authority notes are inventoried but not fully interpreted into the candidate object cuts"
  ],
  "request_digest": "sha256:f63c44c365ccaa800da8fe2caaa916acc4e0bcb5129632cae2ee1ccd58e33cae",
  "schema_kind": "odd_world_model.semantic_cut_attestation",
  "schema_version": "v1",
  "semantic_cut_digest": "sha256:3bc436ce74322bab39d56b7a3e50c31fe37870047535bd255b3ecb4e1eabf0d4",
  "semantic_cut_ref": "semantic-cut://odd_world_model/sandbox/banking_product_model/v1",
  "snapshots": [
    {
      "metadata_location": "file:///Users/jim/src/apps/odd_world_model/examples/banking_product_model/sandbox/20260712T142827Z_0.0.0-development.f94aa30.dirty.cc665fcae1.TS/physical/runtime/warehouse/wm/semantic_publications/metadata/00001-058510c4-6084-4a32-bb87-bfbb55007226.metadata.json",
      "payload_digest": "sha256:8a2313a2406177c96f5ef758ee51adf786ebd5d2d2adecf54910501e1e266fcb",
      "record_count": 2,
      "schema_fingerprint": "sha256:4a7c65c5d35bd4bbe35532f8fccf51246ea08078aac7b35f9b06b1115066b834",
      "snapshot_id": "3970337619250031272",
      "table_identifier": "wm.semantic_publications"
    }
  ],
  "source_refs": [
    "source-corpus://odd_world_model/banking_product_model/v1"
  ],
  "temporal_coordinates": {
    "accepted_at": "2026-07-12T14:28:27.645Z",
    "observed_at": "2026-07-12T14:28:27.645Z"
  },
  "write_request_id": "write://odd_world_model/sandbox/banking_product_model/v1"
}
