{
  "abg_event_refs": [
    "runtime-event:2026-07-12T14:28:27.988Z:176:9c8145e0-dfee-4898-bb55-a0af98fea22e",
    "runtime-event:2026-07-12T14:28:27.988Z:177:6bc0ee7a-e51f-4f14-b3dc-7419f9165ace",
    "runtime-event:2026-07-12T14:28:27.992Z:204:25b2d91c-3d83-4eb3-a9cb-689d06c14fb1",
    "runtime-event:2026-07-12T14:28:28.004Z:255:3a745903-b7de-4b9e-a373-e1a246be751e",
    "runtime-event:2026-07-12T14:28:28.012Z:282:c37fb88d-24fa-4cfc-b7eb-dfc34daee4c5",
    "runtime-event:2026-07-12T14:28:28.023Z:309:0907d0d3-771a-4060-b3be-23816b4d41b6",
    "runtime-event:2026-07-12T14:28:27.990Z:189:4fa4a039-dcac-47bd-a12c-a9e0f94241e5",
    "runtime-event:2026-07-12T14:28:27.994Z:220:36bedb72-a043-4895-b668-41969f0ce8c0",
    "runtime-event:2026-07-12T14:28:27.994Z:223:7facb336-8816-4819-a8ff-953649cf56e8",
    "runtime-event:2026-07-12T14:28:28.007Z:267:961dc48c-c34c-468e-b5f6-1092d9f0777c",
    "runtime-event:2026-07-12T14:28:28.015Z:294:61868011-65f9-4516-833c-1333d52f8b58",
    "runtime-event:2026-07-12T14:28:28.027Z:321:7afd79b1-a1ee-45d6-994a-a850fb322d9d",
    "runtime-event:2026-07-12T14:28:27.991Z:201:f840ab21-61e8-4fc5-a731-948d16cf7b6b",
    "runtime-event:2026-07-12T14:28:28.003Z:253:6afa1df2-2a12-4588-a638-8d4c553e3b83",
    "runtime-event:2026-07-12T14:28:28.010Z:279:ce407fbb-4333-4639-8a41-b4f512496910",
    "runtime-event:2026-07-12T14:28:28.020Z:306:88dfa493-663c-4bfe-9ddb-f8196856e714",
    "runtime-event:2026-07-12T14:28:28.033Z:333:8787b0f6-23e3-4c65-bcff-9b528cb9df34",
    "runtime-event:2026-07-12T14:28:28.035Z:335:ecacd3e8-7a12-4fc8-85f5-d620d194b2dc"
  ],
  "attestation_digest": "sha256:9b39c6e33733e3b7c54d640fcae2f21945f4af19de249478a4178dcd479241bb",
  "attestation_id": "attestation:write://odd_world_model/sandbox/trade_source_model/v1",
  "authority_refs": [
    "authority://fpml/official-example-corpus"
  ],
  "created_at": "2026-07-12T14:28:28.384Z",
  "cut_role": "domain_artifact",
  "cut_version": "v1",
  "dependency_identities": [
    "@abiogenesis/typescript-tenant@4.6.0-rc.3#sha256:9cffb372c0dfc00983a5d0e882efbc3d0c3ac937a56f313000f35a4473358113",
    "@odd-glc/route-one-typescript@0.1.0#sha256:7e548f92ecd6b4442f9c9f1feb46dd2edd7e9610a7dae8706482fc65d80fa578",
    "fast-xml-parser@5.10.0#digest-not-published",
    "fast-xml-validator@1.2.0#digest-not-published",
    "json-canonicalize@2.0.0#digest-not-published",
    "odd-world-model-storage@0.1.0#sha256:8a0b494395099062a87094f02beec86f911d95725b9283105fe2729e56a5fa41",
    "duckdb@1.4.5#digest-not-published",
    "pyiceberg@0.11.1#digest-not-published",
    "rfc8785@0.1.4#digest-not-published"
  ],
  "exclusions": [
    "source-evidence://trade_source_model/uninterpreted-documentation"
  ],
  "fidelity": "lossy_projection",
  "gap_refs": [],
  "governing_refs": [
    "specification/PRODUCT.md",
    "specification/requirements/40-domain-build-verification.md",
    "build_tenants/common/design/adrs/ADR-WM-006-versioned-installed-product-example-sandboxes.md"
  ],
  "graph_invocation_ref": "graph-call:execution_basis:{\"moduleName\":\"gtl://module/odd_world_model/context-memory/v1\",\"startIntent\":{\"scope\":{\"kind\":\"workspace\",\"workspaceRoot\":\"/workspace/odd_world_model/rc3-probe\",\"moduleName\":\"gtl://module/odd_world_model/context-memory/v1\"},\"target\":{\"kind\":\"graph_function\",\"handle\":\"odd_world_model.publish_domain_model\"},\"until\":\"converged\",\"inputBindings\":[{\"assetRef\":\"deterministic-check://odd_world_model/sandbox/trade_source_model/v1\",\"assetType\":\"sandbox_exact_carrier\",\"uri\":\"evidence://odd_world_model/exact/v1?ref=deterministic-check%3A%2F%2Fodd_world_model%2Fsandbox%2Ftrade_source_model%2Fv1&digest=sha256%3Abc5d9e30d12ceea1101941da1cadf8af6a9b9f6533acc4ebe6546b738134b18e\"},{\"assetRef\":\"wm-acceptance://odd_world_model/sandbox/trade_source_model/v1\",\"assetType\":\"sandbox_exact_carrier\",\"uri\":\"evidence://odd_world_model/exact/v1?ref=wm-acceptance%3A%2F%2Fodd_world_model%2Fsandbox%2Ftrade_source_model%2Fv1&digest=sha256%3A0933678bcdb12faac4e301d32dd2536e4f73586eadd3953be221d3435374871c\"}]},\"runtimeIdentity\":{\"workerId\":\"worker://odd_world_model/rc3-probe/v1\",\"backendId\":\"backend://abiogenesis/typescript/v4.6.0-rc.3\",\"buildId\":\"build://odd_world_model/typescript/0.1.0-proving.1\",\"resolvedRuntimeRef\":\"runtime://abiogenesis/4.6.0-rc.3\"},\"resolvedPolicy\":{\"resolvedPolicyBundleRef\":\"policy-bundle://odd_world_model/rc3-probe/v1\",\"defaultRegime\":\"F_D\",\"dispatchRef\":\"dispatch://odd_world_model/rc3-probe/v1\",\"approvalSubjectRef\":null},\"runId\":\"run://odd_world_model/odd_world_model.publish_domain_model/rc3-probe/trade_source_model-acceptance-v1\",\"workKey\":\"work://odd_world_model/odd_world_model.publish_domain_model/rc3-probe/trade_source_model-acceptance-v1\",\"frameId\":null,\"frameLineageId\":null}",
  "losses": [
    "FpML syntax, example-index content, and non-economic documentation are inventoried but not copied into the interpreted trade payload"
  ],
  "request_digest": "sha256:cef950e94b53c2a572d8c901dad5e53b3212f841883f1cc83e7879857afd3638",
  "schema_kind": "odd_world_model.semantic_cut_attestation",
  "schema_version": "v1",
  "semantic_cut_digest": "sha256:98353e2045b4bcb468040227175bf50f204c687b1c7e4d2e4780eaaae5f3dc6d",
  "semantic_cut_ref": "semantic-cut://odd_world_model/sandbox/trade_source_model/v1",
  "snapshots": [
    {
      "metadata_location": "file:///Users/jim/src/apps/odd_world_model/examples/trade_source_model/sandbox/20260712T142827Z_0.0.0-development.f94aa30.dirty.cc665fcae1.TS/physical/runtime/warehouse/wm/semantic_publications/metadata/00001-98d097e5-6c9a-45dd-a027-7a2b39d9ce14.metadata.json",
      "payload_digest": "sha256:e242490f9d7db0138565f6ac7346718534d5ef6ff97e6e29ed82bc0ab3f998d9",
      "record_count": 2,
      "schema_fingerprint": "sha256:4a7c65c5d35bd4bbe35532f8fccf51246ea08078aac7b35f9b06b1115066b834",
      "snapshot_id": "803815983928620142",
      "table_identifier": "wm.semantic_publications"
    }
  ],
  "source_refs": [
    "source-corpus://odd_world_model/trade_source_model/v1"
  ],
  "temporal_coordinates": {
    "accepted_at": "2026-07-12T14:28:27.645Z",
    "observed_at": "2026-07-12T14:28:27.645Z"
  },
  "write_request_id": "write://odd_world_model/sandbox/trade_source_model/v1"
}
